{
  "schema_version": "1.0",
  "kind": "asset-manifest",
  "framework_version": "synthetic-example",
  "assets": [
    {
      "path": "synthetic-example",
      "sha256": "bbbbbbbbbbbbbbbbbbbbbbbbbbbbbbbbbbbbbbbbbbbbbbbbbbbbbbbbbbbbbbbb",
      "ownership": "framework",
      "source_ref": "synthetic-example"
    }
  ],
  "migration_ids": []
}
